{"$schema":"https://json-schema.org/draft/2020-12/schema","$id":"https://r8-kumamoto-saigai.local/schemas/reconstruction/source-link.schema.json","type":"array","items":{"type":"object","additionalProperties":false,"required":["id","sourceId","entityType","entityId","claimType","page","section","table","excerpt","verifiedBy","verifiedAt"],"properties":{"id":{"type":"string","pattern":"^source_link_[a-z0-9_]+$"},"sourceId":{"type":"string"},"entityType":{"enum":["disaster","program","application","application_period","required_document","contact","next_action"]},"entityId":{"type":"string"},"claimType":{"enum":["general_description","disaster_application","eligible_area","eligibility","eligible_damage","benefit","amount","start_date","deadline","required_document","application_office","contact","warning","closure","other"]},"page":{"type":["integer","null"],"minimum":1},"section":{"type":["string","null"]},"table":{"type":["string","null"]},"excerpt":{"type":["string","null"]},"verifiedBy":{"type":["string","null"]},"verifiedAt":{"$ref":"common.schema.json#/$defs/nullableDateOrDateTime"}}}}
