[
  {"id":"source_link_disaster_official_notifications_cabinet","sourceId":"source_cabinet_notifications_r8_kumamoto_earthquake","entityType":"disaster","entityId":"disaster_2026_kumamoto_earthquake","claimType":"other","page":null,"section":"内閣府防災担当からの各都道府県等への通知等","table":"通知一覧","excerpt":"令和8年7月31日から8月7日までの通知6件を掲載し、8月3日付『被災者の住まいの確保に向けた留意事項について』を含む。通知一覧への公式入口として扱い、制度の金額・条件を単独で裏付けるsourceLinkには使用しない。","verifiedBy":null,"verifiedAt":null},
  {"id":"source_link_disaster_relief_act_areas_cabinet","sourceId":"source_cabinet_relief_act_application_r8_earthquake","entityType":"disaster","entityId":"disaster_2026_kumamoto_earthquake","claimType":"disaster_application","page":1,"section":"災害救助法施行令第1条第1項第4号適用","table":"法適用市町村・法適用日","excerpt":"内閣府が宇土市を含む県内21市町村への適用と7月28日の法適用日を公表。","verifiedBy":null,"verifiedAt":null},
  {"id":"source_link_disaster_relief_act_areas","sourceId":"source_kumamoto_relief_act_application_r8_earthquake","entityType":"disaster","entityId":"disaster_2026_kumamoto_earthquake","claimType":"disaster_application","page":null,"section":"1 災害救助法の適用","table":null,"excerpt":"令和8年7月28日付で、宇土市を含む県内21市町村への災害救助法適用を公表。","verifiedBy":null,"verifiedAt":null},
  {"id":"source_link_program_repair_general","sourceId":"source_cabinet_disaster_relief_act_overview","entityType":"program","entityId":"program_emergency_housing_repair","claimType":"general_description","page":1,"section":"2 救助の種類、程度、方法及び期間","table":"救助の種類","excerpt":"災害救助法による応急救助の種類として住宅の応急修理を掲げる。","verifiedBy":null,"verifiedAt":null},
  {"id":"source_link_application_repair_implemented","sourceId":"source_kumamoto_emergency_housing_repair_page","entityType":"application","entityId":"application_r8_kumamoto_emergency_repair","claimType":"disaster_application","page":null,"section":"被災した住宅の応急修理について","table":null,"excerpt":"令和8年熊本地震で被災した住宅の応急修理を開始すると公表。","verifiedBy":null,"verifiedAt":null},
  {"id":"source_link_application_repair_areas","sourceId":"source_kumamoto_emergency_housing_repair_guideline","entityType":"application","entityId":"application_r8_kumamoto_emergency_repair","claimType":"eligible_area","page":5,"section":"別表 市町村名","table":"対象20市町村","excerpt":"県実施の対象として宇土市を含む20市町村を列挙。熊本市は別途実施。","verifiedBy":null,"verifiedAt":null},
  {"id":"source_link_application_repair_eligibility","sourceId":"source_kumamoto_emergency_housing_repair_user_guide","entityType":"application","entityId":"application_r8_kumamoto_emergency_repair","claimType":"eligibility","page":1,"section":"対象者","table":null,"excerpt":"資力、現状では住めないこと、修理後に住める見込みの3要件を示す。","verifiedBy":null,"verifiedAt":null},
  {"id":"source_link_application_repair_damage","sourceId":"source_kumamoto_emergency_housing_repair_user_guide","entityType":"application","entityId":"application_r8_kumamoto_emergency_repair","claimType":"eligible_damage","page":1,"section":"対象者","table":null,"excerpt":"大規模半壊、中規模半壊、半壊、準半壊を対象とし、全壊には例外を示す。","verifiedBy":null,"verifiedAt":null},
  {"id":"source_link_application_repair_scope","sourceId":"source_kumamoto_emergency_housing_repair_user_guide","entityType":"application","entityId":"application_r8_kumamoto_emergency_repair","claimType":"benefit","page":1,"section":"対象となる修理箇所","table":null,"excerpt":"屋根、開口部、配管・配線、衛生設備等の日常生活に必要な最小限度の修理。","verifiedBy":null,"verifiedAt":null},
  {"id":"source_link_application_repair_amount","sourceId":"source_kumamoto_emergency_housing_repair_user_guide","entityType":"application","entityId":"application_r8_kumamoto_emergency_repair","claimType":"amount","page":1,"section":"限度額","table":null,"excerpt":"全壊から半壊は75万7千円以内、準半壊は36万7千円以内。いずれも税込。","verifiedBy":null,"verifiedAt":null},
  {"id":"source_link_application_repair_office","sourceId":"source_kumamoto_emergency_housing_repair_user_guide","entityType":"application","entityId":"application_r8_kumamoto_emergency_repair","claimType":"application_office","page":2,"section":"申込先","table":null,"excerpt":"被災した市町村の窓口へ申し込むよう案内。","verifiedBy":null,"verifiedAt":null},
  {"id":"source_link_application_repair_uto_pending","sourceId":"source_kumamoto_emergency_housing_repair_page","entityType":"application","entityId":"application_r8_kumamoto_emergency_repair","claimType":"other","page":null,"section":"市町村窓口一覧","table":"宇土市行","excerpt":"宇土市の担当課、開始日、連絡先、ホームページは全て『確認中』と表示。","verifiedBy":null,"verifiedAt":null},
  {"id":"source_link_application_repair_uto_index_checked","sourceId":"source_uto_support_application_index_r8_earthquake","entityType":"application","entityId":"application_r8_kumamoto_emergency_repair","claimType":"other","page":null,"section":"支援・申請の記事一覧","table":null,"excerpt":"2026年8月10日の再確認で、8月7日付の住宅の応急修理個別案内と、すまいの相談窓口案内への掲載を確認。","verifiedBy":null,"verifiedAt":null},
  {"id":"source_link_application_repair_uto_eligibility_candidate","sourceId":"source_uto_emergency_housing_repair_page_r8_earthquake","entityType":"application","entityId":"application_r8_kumamoto_emergency_repair","claimType":"eligibility","page":null,"section":"対象者","table":null,"excerpt":"宇土市ページが被害区分、資力、居住困難、修理後の居住見込み等を案内。県資料との差異を含め人手確認が必要。","verifiedBy":null,"verifiedAt":null},
  {"id":"source_link_application_repair_uto_amount_candidate","sourceId":"source_uto_emergency_housing_repair_page_r8_earthquake","entityType":"application","entityId":"application_r8_kumamoto_emergency_repair","claimType":"amount","page":null,"section":"応急修理の限度額","table":null,"excerpt":"1世帯あたり75万7千円以内、準半壊は36万7千円以内、税込と案内。","verifiedBy":null,"verifiedAt":null},
  {"id":"source_link_application_repair_uto_deadline_candidate","sourceId":"source_uto_emergency_housing_repair_page_r8_earthquake","entityType":"application","entityId":"application_r8_kumamoto_emergency_repair","claimType":"deadline","page":null,"section":"応急修理の完了期限","table":null,"excerpt":"2026年10月27日までに完了報告書・工事写真を含め完了と案内し、期限延長見込みとも記載。確定期限として登録する前に人手判断が必要。","verifiedBy":null,"verifiedAt":null},
  {"id":"source_link_application_repair_uto_office_candidate","sourceId":"source_uto_housing_consultation_desk_r8_earthquake","entityType":"application","entityId":"application_r8_kumamoto_emergency_repair","claimType":"application_office","page":null,"section":"受付場所・受付時間・問い合わせ先","table":null,"excerpt":"宇土市役所1階市民交流スペース、平日9時から16時（正午から13時を除く）、すまい再建支援班直通0964-27-6647と案内。10月31日（土）は窓口開庁、火曜日の賃貸型応急住宅相談は10月27日で終了予定。","verifiedBy":"system_codex","verifiedAt":"2026-10-26T09:40:00+09:00"},
  {"id":"source_link_application_repair_uto_warning_candidate","sourceId":"source_uto_emergency_housing_repair_page_r8_earthquake","entityType":"application","entityId":"application_r8_kumamoto_emergency_repair","claimType":"warning","page":null,"section":"注意事項","table":null,"excerpt":"修理前写真が必要で、制度利用前に宇土市すまいの相談窓口へ相談するよう案内。契約前・支払前の意味は県資料と併せて人手確認する。","verifiedBy":null,"verifiedAt":null},
  {"id":"source_link_contact_prefecture_housing_team","sourceId":"source_kumamoto_emergency_housing_repair_user_guide","entityType":"contact","entityId":"contact_kumamoto_prefecture_housing_measures_team","claimType":"contact","page":2,"section":"問い合わせ先","table":null,"excerpt":"県健康福祉政策課すまい対策チームと電話番号を案内。","verifiedBy":null,"verifiedAt":null},
  {"id":"source_link_period_application_pending","sourceId":"source_kumamoto_emergency_housing_repair_page","entityType":"application_period","entityId":"period_r8_kumamoto_emergency_repair_application_pending","claimType":"deadline","page":null,"section":"市町村の受付窓口","table":"受付窓口一覧","excerpt":"市町村ごとに準備が整い次第開始。宇土市の開始日は確認中で、申込期限は掲載なし。","verifiedBy":null,"verifiedAt":null},
  {"id":"source_link_document_application_form","sourceId":"source_kumamoto_emergency_housing_repair_user_guide","entityType":"required_document","entityId":"document_repair_application_form","claimType":"required_document","page":2,"section":"提出する書類","table":null,"excerpt":"応急修理申込書を提出書類として掲載。","verifiedBy":null,"verifiedAt":null},
  {"id":"source_link_document_damage_statement","sourceId":"source_kumamoto_emergency_housing_repair_user_guide","entityType":"required_document","entityId":"document_housing_damage_statement","claimType":"required_document","page":2,"section":"提出する書類","table":null,"excerpt":"住宅の被害状況に関する申出書を提出書類として掲載。","verifiedBy":null,"verifiedAt":null},
  {"id":"source_link_document_disaster_certificate","sourceId":"source_kumamoto_emergency_housing_repair_user_guide","entityType":"required_document","entityId":"document_disaster_certificate","claimType":"required_document","page":2,"section":"提出する書類","table":null,"excerpt":"り災証明書を提出書類として掲載。","verifiedBy":null,"verifiedAt":null},
  {"id":"source_link_document_photos","sourceId":"source_kumamoto_emergency_housing_repair_user_guide","entityType":"required_document","entityId":"document_pre_repair_photos","claimType":"required_document","page":2,"section":"提出する書類・注意","table":null,"excerpt":"修理前の被害状況写真を提出書類とし、工事前撮影を注意喚起。","verifiedBy":null,"verifiedAt":null},
  {"id":"source_link_document_estimate","sourceId":"source_kumamoto_emergency_housing_repair_user_guide","entityType":"required_document","entityId":"document_repair_estimate","claimType":"required_document","page":2,"section":"提出する書類","table":null,"excerpt":"修理見積書を提出書類として掲載。","verifiedBy":null,"verifiedAt":null},
  {"id":"source_link_document_financial_statement","sourceId":"source_kumamoto_emergency_housing_repair_user_guide","entityType":"required_document","entityId":"document_financial_resources_statement","claimType":"required_document","page":2,"section":"提出する書類","table":null,"excerpt":"資力に関する申出書を提出書類として掲載。","verifiedBy":null,"verifiedAt":null},
  {"id":"source_link_document_checklist","sourceId":"source_kumamoto_emergency_housing_repair_user_guide","entityType":"required_document","entityId":"document_repair_application_checklist","claimType":"required_document","page":2,"section":"提出する書類","table":null,"excerpt":"応急修理申込時のチェックリストを提出書類として掲載。","verifiedBy":null,"verifiedAt":null},